{
  "mediaType": "application/vnd.agdr+json",
  "specVersion": "1.2",
  "id": "AgDR-0001",
  "timestamp": "2026-02-04T12:00:00Z",
  "agent": "claude-code",
  "model": "claude-opus-4-5",
  "trigger": "user-prompt",
  "status": "executed",
  "title": "Auth Provider for Serverless Chrome Extension",
  "yStatement": "In the context of replacing API key auth in a 100% AWS serverless stack, facing the need for proper user identity with minimal maintenance, I decided to use AWS Cognito User Pools to achieve native API Gateway integration and managed security, accepting the limited Hosted UI aesthetics and AWS vendor lock-in.",
  "context": ["Backend is 100% AWS (SAM, Lambda, API Gateway, DynamoDB)", "Currently uses API keys with actor name in request bodies — no real identity", "Chrome extension uses chrome.identity.launchWebAuthFlow for OAuth flows", "Small user base, personal project with minimal budget", "Need: login, token refresh, user identity in JWT claims"],
  "optionsConsidered": [
    { "name": "AWS Cognito", "pros": ["Native API Gateway authorizer (zero auth code)", "free 50K MAU tier", "SAM AWS::Cognito::* resources", "OAuth2/OIDC compliant", "managed password security"], "cons": ["Hosted UI is basic", "complex config surface", "AWS lock-in"] },
    { "name": "Auth0", "pros": ["Polished login UI", "Excellent DX", "7.5K MAU free tier"], "cons": ["External vendor", "Custom Lambda authorizer needed", "Extra CORS config", "Additional billing account"] },
    { "name": "Firebase Auth", "pros": ["Simple SDK", "Good Chrome extension support", "Generous free tier"], "cons": ["Mixes GCP + AWS", "Custom Lambda authorizer", "No SAM integration", "Two cloud vendors to manage"] },
    { "name": "Custom JWT", "pros": ["Full control", "No external deps"], "cons": ["Must build: registration", "bcrypt hashing", "JWT signing/refresh/revocation", "password reset. Security burden. Ongoing maintenance."] }
  ],
  "decision": "Use AWS Cognito because its managed authorizer removes custom token verification from the application.",
  "consequences": ["Hosted UI will be used for login (functional but not beautiful) — acceptable for early-stage product", "SAM template grows with UserPool, UserPoolClient, UserPoolDomain resources", "All existing API handlers must switch from API key check to extractUserContext() from Cognito JWT claims", "Extension needs identity permission in manifest and OAuth redirect handling", "Future migration away from Cognito would require replacing the authorizer and token format"],
  "extensions": {}
}
